{
  "schema_version": 1,
  "success": true,
  "command": "wheelctl hardware sniff-receipt",
  "generated_at_utc": "2026-05-20T02:31:07Z",
  "plan_path": "ci/hardware/sniff/moza-r5/2026-05-13/pit-house-full-controls/sniff-plan.json",
  "pcapng_path": "target/sniff/pit-house-full-controls/capture.pcapng",
  "pcapng_sha256": "dbde49919cf67a41a086c08e5f629ba0b12c91cb772c735c4350368629d37c08",
  "pcapng_size_bytes": 4490724,
  "operator": "Steven",
  "app": "MOZA Pit House 1.3.8.38 release",
  "scenario": "pit-house-full-controls",
  "device_note": "Moza R5 PID 0x0004 with KS/ES wheels, SR-P pedals, and HBP handbrake attached through the R5 hub; filtered USBPcap bus 2 device address 3",
  "evidence": "operator-recorded 60.131s passive Pit House full-controls capture on 2026-05-19; action order wheel movement -> HBP handbrake -> gas pedal -> brake pedal -> clutch pedal -> wheel buttons; OpenRacing opened no HID device and sent no output, feature, serial, firmware, or DFU commands; raw root-hub pcapng kept local and filtered R5-only pcapng used for analysis",
  "evidence_status": "passive_external_usb_observation",
  "native_control_evidence": false,
  "openracing_hardware_output": false,
  "openracing_hid_device_opened": false,
  "openracing_ffb_writes": false,
  "openracing_output_reports": false,
  "openracing_feature_reports": false,
  "openracing_serial_config_commands": false,
  "openracing_firmware_or_dfu_commands": false,
  "external_app_observed": true,
  "external_app_may_have_sent_output": true,
  "satisfies_native_response_ready": false,
  "satisfies_native_visible_ready": false,
  "satisfies_smoke_ready": false,
  "satisfies_release_ready": false,
  "readiness_claims": {
    "satisfies_native_response_ready": false,
    "satisfies_native_visible_ready": false,
    "satisfies_smoke_ready": false,
    "satisfies_release_ready": false
  }
}