{
  "schema_version": 1,
  "success": true,
  "command": "wheelctl hardware sniff-receipt",
  "generated_at_utc": "2026-05-27T16:38:52Z",
  "plan_path": "ci/hardware/sniff/moza-r5/2026-05-13/pit-house-setting-change/sniff-plan.json",
  "pcapng_path": "target/sniff/pit-house-setting-change-repeat-02/capture.pcapng",
  "pcapng_sha256": "39d43f3454648ea9767e3cf88740073eec9f120ca42f36dfa438fd8f2707d3fc",
  "pcapng_size_bytes": 6259122,
  "operator": "Steven",
  "app": "MOZA Pit House",
  "scenario": "pit-house-setting-change",
  "device_note": "Moza R5 PID 0x0004 with KS/ES wheels, SR-P pedals, and HBP handbrake attached through the R5 hub",
  "evidence": "Pit House closed, Pit House opened, KS wheel top-left front LED changed from default teal to red, then changed back to default teal. No firmware/update/DFU page or prompt was observed by the operator, and no firmware/update/DFU interaction was performed.",
  "evidence_status": "passive_external_usb_observation",
  "native_control_evidence": false,
  "openracing_hardware_output": false,
  "openracing_hid_device_opened": false,
  "openracing_ffb_writes": false,
  "openracing_output_reports": false,
  "openracing_feature_reports": false,
  "openracing_serial_config_commands": false,
  "openracing_firmware_or_dfu_commands": false,
  "external_app_observed": true,
  "external_app_may_have_sent_output": true,
  "satisfies_native_response_ready": false,
  "satisfies_native_visible_ready": false,
  "satisfies_smoke_ready": false,
  "satisfies_release_ready": false,
  "readiness_claims": {
    "satisfies_native_response_ready": false,
    "satisfies_native_visible_ready": false,
    "satisfies_smoke_ready": false,
    "satisfies_release_ready": false
  }
}
