{
  "schema_version": 1,
  "success": true,
  "command": "wheelctl hardware sniff-receipt",
  "generated_at_utc": "2026-05-19T23:05:15Z",
  "plan_path": "ci/hardware/sniff/moza-r5/2026-05-13/pit-house-open-idle/sniff-plan.json",
  "pcapng_path": "target/sniff/pit-house-open-idle/capture.pcapng",
  "pcapng_sha256": "600111023b27cccb95138f59b1e64a73b35af34a48b6fc7d0f2f89f03dd82927",
  "pcapng_size_bytes": 618432,
  "operator": "Steven",
  "app": "MOZA Pit House",
  "scenario": "pit-house-open-idle",
  "device_note": "Moza R5 PID 0x0004 with KS/ES wheels, SR-P pedals, and HBP handbrake attached through the R5 hub",
  "evidence": "operator-recorded passive USBPcap2 capture for pit-house-open-idle; Pit House process/window was open; capture filtered to Moza R5 USB bus 2 device address 3; OpenRacing opened no HID device and sent no output, feature, serial, firmware, or DFU commands",
  "evidence_status": "passive_external_usb_observation",
  "native_control_evidence": false,
  "openracing_hardware_output": false,
  "openracing_hid_device_opened": false,
  "openracing_ffb_writes": false,
  "openracing_output_reports": false,
  "openracing_feature_reports": false,
  "openracing_serial_config_commands": false,
  "openracing_firmware_or_dfu_commands": false,
  "external_app_observed": true,
  "external_app_may_have_sent_output": true,
  "satisfies_native_response_ready": false,
  "satisfies_native_visible_ready": false,
  "satisfies_smoke_ready": false,
  "satisfies_release_ready": false,
  "readiness_claims": {
    "satisfies_native_response_ready": false,
    "satisfies_native_visible_ready": false,
    "satisfies_smoke_ready": false,
    "satisfies_release_ready": false
  }
}